{
  "proposer": "0x1CBd3b2770909D4e10f157cABC84C7264073C9Ec",
  "wallets": [
    "0x1cbd3b2770909d4e10f157cabc84c7264073c9ec"
  ],
  "statement": "I disclose only my personal author wallet 13. The storage optimization upgrade involves no external beneficiaries.",
  "signature": "0x1c255c14156173ff3d3c044ca69a845af601f9c9deccbc12c997d544c79df96a68f820cc4dcc49680dceaece5be332799ad52a94e82257fd213c09f4fdfe83321b"
}
