{
  "proposer": "0xBcd4042DE499D14e55001CcbB24a551F3b954096",
  "wallets": [
    "0xbcd4042de499d14e55001ccbb24a551f3b954096"
  ],
  "statement": "I declare sole ownership of proposer wallet 10. Nexus Labs is an independent third-party with no financial ties.",
  "signature": "0x872198114b5d19891e6a3b78f5676c7f19f3992937ed70f72488b51ba1ab36df00cfceb165626e01180418b42f16fda9fc1437c6b3577d303b5d0d10def0e6331c"
}
